{
  "schema": "openauthor.assistant.turn",
  "schema_version": 1,
  "turn_id": "turn_mara_0042",
  "thread_id": "thread_mara_harbor",
  "project_id": "project_glass_harbor",
  "project_revision": "rev_7e3c1a",
  "channel": "mobile_voice",
  "request_sha256": "sha256:3333333333333333333333333333333333333333333333333333333333333333",
  "status": "completed",
  "created_at": "2026-08-30T15:04:05.000Z",
  "started_at": "2026-08-30T15:04:06.000Z",
  "completed_at": "2026-08-30T15:04:12.000Z",
  "context_pack": {
    "schema": "openauthor.context-pack.reference",
    "schema_version": 1,
    "pack_id": "ctx_glass_harbor_0042",
    "project_id": "project_glass_harbor",
    "project_revision": "rev_7e3c1a",
    "content_sha256": "sha256:1111111111111111111111111111111111111111111111111111111111111111"
  },
  "message_ids": ["msg_mara_question", "msg_assistant_answer"],
  "tool_call_ids": ["call_scene_0042"],
  "revision": 3
}
